{
  "$schema": "https://json-schema.org/draft/2020-12/schema",
  "$id": "https://open-learn-core.example/schemas/concept.schema.json",
  "title": "Concept",
  "type": "object",
  "additionalProperties": false,
  "required": ["id", "title", "summary", "prerequisites", "related", "learningObjectives", "content", "examples", "exercises", "misconceptions", "sources"],
  "properties": {
    "id": { "type": "string", "pattern": "^[a-z][a-z0-9-]*$" },
    "title": { "$ref": "#/$defs/localized" },
    "summary": { "$ref": "#/$defs/localized" },
    "prerequisites": { "type": "array", "items": { "type": "string" }, "uniqueItems": true },
    "related": { "type": "array", "items": { "type": "string" }, "uniqueItems": true },
    "learningObjectives": { "type": "array", "minItems": 1, "items": { "type": "string", "minLength": 1 } },
    "content": { "type": "object", "required": ["explanation"], "additionalProperties": false, "properties": { "explanation": { "type": "string", "minLength": 1 } } },
    "examples": { "type": "array", "items": { "$ref": "#/$defs/example" } },
    "exercises": { "type": "array", "items": { "$ref": "#/$defs/exercise" } },
    "misconceptions": { "type": "array", "items": { "type": "string", "minLength": 1 } },
    "sources": { "type": "array", "minItems": 1, "items": { "type": "string" }, "uniqueItems": true }
  },
  "$defs": {
    "localized": { "type": "object", "required": ["ja", "en"], "additionalProperties": false, "properties": { "ja": { "type": "string", "minLength": 1 }, "en": { "type": "string", "minLength": 1 } } },
    "example": { "type": "object", "additionalProperties": false, "required": ["id", "statement", "explanation"], "properties": { "id": { "type": "string" }, "statement": { "type": "string", "minLength": 1 }, "explanation": { "type": "string", "minLength": 1 } } },
    "exercise": { "type": "object", "additionalProperties": false, "required": ["id", "type", "difficulty", "question", "answer", "explanation"], "properties": { "id": { "type": "string" }, "type": { "type": "string" }, "difficulty": { "type": "string" }, "question": { "type": "string", "minLength": 1 }, "answer": { "type": "string", "minLength": 1 }, "explanation": { "type": "string", "minLength": 1 } } }
  }
}
