{
  "id": "matrix-representation",
  "title": { "ja": "線形写像の行列表示", "en": "Matrix Representation" },
  "summary": { "ja": "基底を選ぶことで線形写像を行列として表す方法。", "en": "Representing a linear map by a matrix after choosing bases." },
  "prerequisites": ["linear-map", "matrix", "basis"],
  "related": ["dimension", "linear-combination"],
  "learningObjectives": ["基底ベクトルの像から表現行列を作れる", "行列表示が基底の選択に依存することを説明できる"],
  "content": { "explanation": "Vの基底BとWの基底Cを選ぶと、線形写像T:V→Wは行列で表せます。第j列には、TがBの第j基底ベクトルを写した結果をCで座標表示したものを置きます。この行列に入力ベクトルのB座標を掛けると、出力のC座標が得られます。" },
  "examples": [{ "id": "matrix-representation-example-001", "statement": "T(x,y)=(x+y,y)を標準基底で表す行列を求める。", "explanation": "T(1,0)=(1,0), T(0,1)=(1,1)なので、列を並べて[[1,1],[0,1]]です。" }],
  "exercises": [{ "id": "matrix-representation-exercise-001", "type": "short-answer", "difficulty": "basic", "question": "表現行列の第j列は何を表すか。", "answer": "定義域の基底の第jベクトルの像を、終域の基底で座標表示したもの", "explanation": "行列と座標ベクトルの積が線形写像の作用を再現するように列を定めます。" }],
  "misconceptions": ["線形写像そのものと表現行列は同一ではない。行列は基底を選んだ後の座標表示であり、基底を変えると一般に行列も変わる。"],
  "sources": ["mit-ocw-linear-algebra", "openstax-linear-algebra"]
}
