{
  "id": "linear-independence",
  "title": { "ja": "線形独立", "en": "Linear Independence" },
  "summary": { "ja": "零ベクトルを作る線形結合が自明なものだけである性質。", "en": "A set whose zero linear combination has only zero coefficients." },
  "prerequisites": ["vector", "linear-combination"],
  "related": ["span", "basis", "dimension"],
  "learningObjectives": ["線形独立の定義を使って判定できる", "線形従属なら冗長なベクトルを説明できる"],
  "content": { "explanation": "v1,...,vkが線形独立とは、c1v1+...+ckvk=0からc1=...=ck=0しか導けないことです。非自明な係数で零ベクトルになるなら線形従属です。線形従属な集合では、少なくとも1本のベクトルが他のベクトルの線形結合で表せるため、生成のために冗長な要素が含まれています。" },
  "examples": [{ "id": "linear-independence-example-001", "statement": "(1,2)と(2,4)は線形独立か。", "explanation": "(2,4)=2(1,2)なので、2(1,2)-(2,4)=0という非自明な関係があり、線形従属です。" }],
  "exercises": [{ "id": "linear-independence-exercise-001", "type": "short-answer", "difficulty": "basic", "question": "R²の3本のベクトルは線形独立になり得るか。", "answer": "なり得ない", "explanation": "R²の次元は2であり、3本なら必ず非自明な線形関係が存在します。" }],
  "misconceptions": ["線形独立はベクトル同士が直交することではない。直交は十分条件になる場合があるが、定義は線形結合の係数に関するもの。"],
  "sources": ["mit-ocw-linear-algebra", "openstax-linear-algebra"]
}
