{
  "id": "vector-addition",
  "title": { "ja": "ベクトルの加法", "en": "Vector Addition" },
  "summary": { "ja": "対応する成分を足して、2つのベクトルを1つにまとめる演算。", "en": "The operation that adds vectors component by component." },
  "prerequisites": ["vector"],
  "related": ["scalar-multiplication", "linear-combination"],
  "learningObjectives": ["ベクトル和を成分計算できる", "交換法則と結合法則を使える"],
  "content": { "explanation": "R^nのベクトル u=(u1,...,un) と v=(v1,...,vn) の和は、u+v=(u1+v1,...,un+vn) と定義します。幾何的には、平行移動した矢印をつなぐ三角形則に対応します。加法は順序を変えても結果が同じで、3本以上の和では括弧の付け方も結果に影響しません。" },
  "examples": [{ "id": "vector-addition-example-001", "statement": "(1,2)+(-1,5) を計算する。", "explanation": "(1-1,2+5)=(0,7) です。" }],
  "exercises": [{ "id": "vector-addition-exercise-001", "type": "short-answer", "difficulty": "basic", "question": "a=(1,0), b=(2,3), c=(-1,4) のとき a+b+c を求めよ。", "answer": "(2,7)", "explanation": "(1+2-1, 0+3+4)=(2,7) です。" }],
  "misconceptions": ["ベクトルの和は長さだけを足すものではなく、成分（または幾何的な矢印）を足す。"],
  "sources": ["mit-ocw-linear-algebra"]
}
